{"universe":["q-where","q-size","q-parts","kind:org"],
 "tree":{"id":"root","question":"What is Org Alpha?","answer_type":"judgment","children":[
   {"id":"q-where","question":"Where is it?","answer_type":"fact","children":[]},
   {"id":"q-size","question":"How large is it?","answer_type":"number","children":[]},
   {"id":"q-parts","question":"What does it consist of?","answer_type":"list","children":[]}]},
 "regions":[{"id":"region-a","label":"angle A","elements":["q-where","q-parts","kind:org"]},
            {"id":"region-b","label":"angle B","elements":["q-where","q-size","kind:org"]},
            {"id":"region-c","label":"angle C","elements":["q-size","q-parts","kind:org"]}],
 "relation_vocab":[{"name":"located_in","value_type":"qualitative"},
                   {"name":"has_part","value_type":"qualitative"},
                   {"name":"headcount","value_type":"numeric","unit_dimension":"count"}]}
