{"universe":["q1","q2","kind:org"],"tree":{"id":"root","question":"placeholder root","answer_type":"judgment","children":[{"id":"q1","question":"a","answer_type":"fact","children":[]},{"id":"q2","question":"b","answer_type":"number","children":[]}]},"regions":[{"id":"r1","elements":["q1","kind:org"]},{"id":"r2","elements":["q2","kind:org"]}],"relation_vocab":[{"name":"has_part","value_type":"qualitative"},{"name":"length","value_type":"numeric","unit_dimension":"length"}]}
